{
  "schemaVersion": "genesis-corpus-manifest/v1",
  "corpusStatus": "AWAITING_PRIVATE_SOURCES",
  "requiredDomainCoverage": [
    "Merge / AMICAS PACS",
    "Merge RIS",
    "AbbaDox CareFlow",
    "MagView",
    "eClinicalWorks / eCW",
    "Hologic",
    "PowerScribe",
    "Rad AI",
    "Altamont",
    "DynaCAD",
    "AbbaDox migration",
    "Baxter project/integration",
    "Rad AI / ViewPoint retirement direction",
    "Breast-imaging architecture changes"
  ],
  "entries": []
}
